{"analysis":{"charge-ledger":"Maximum charge-plus-sink relative residual <1% on every 100-period trace.","convergence":"Local frequencies differ by <1%; absolute final mode-energy fractions differ by <0.01 on mesh/time controls.","frozen-inputs":"All input SHA-256 values match the frozen Test 6 profiles and modes.","lifetime":"Absolute final projected mode-energy change <1% on base, h/2 and dt/2 over 100 nominal periods.","local-record":"Each 100-period trace has at least 99 positive-going crossings and frequency within 2% of frozen Omega."},"experiment_id":"gross.clock-longevity.v1","model_id":"signal-space.ss-ocf-1.flat-clock.v1","parameters":{"clock_amplitude":0.001,"cycles":100,"frozen_inputs":[{"name":"profile-0.900.npz","path":"research/experiments/gross.bound-clock.v1/run-080a63d117abd84d/attempts/attempt-0001/raw/profile-0.900.npz","sha256":"6b1e06d47b6a9236698f044e103764b397b77c16f927ab2f1e539f263d43a3db"},{"name":"profile-fine.npz","path":"research/experiments/gross.bound-clock.v1/run-080a63d117abd84d/attempts/attempt-0001/raw/profile-fine.npz","sha256":"31b59ce23d938e52ee1b9e6404c3a4d46aa47b7b34c9135b83420f067335f24b"},{"name":"profile-wide.npz","path":"research/experiments/gross.bound-clock.v1/run-080a63d117abd84d/attempts/attempt-0001/raw/profile-wide.npz","sha256":"a0c1da472185a699fb0c489f8396a7946fce3e0fa869ffd405403af8b8ea5687"}],"grids":["base","fine","time"],"kind":"longevity","local_radius":0.1,"omega_Q":0.9,"omega_chi":0.41274991},"report":{"title":"Signal Space Test 6 prerequisite: longevity"},"resources":{"max_cpu_seconds":1700,"max_memory_mb":1024,"max_output_mb":100,"max_wall_seconds":1800},"schema_version":"research-experiment-v1","seeds":{"root":2026092561},"units":{"length":"m^-1","mass":"m=1","signal":"c=hbar=1","time":"m^-1"}}
